<?xml version="1.0" encoding="UTF-8"?>
<generator_catalog xmlns:xsi="http://www.w3.org/2001/XMLSchema-instance" xmlns="http://www.dima.tu-berlin.de/myriad/specification" xsi:schemaLocation="http://www.dima.tu-berlin.de/myriad/specification ../specification.xsd">

  <!-- function configuration -->
  <functions>
    <function key="Pr[male_name]" type="custom_discrete_probability" />
    <function key="Pr[female_name]" type="custom_discrete_probability" />
    <function key="Pr[surname]" type="custom_discrete_probability" />
    <function key="Pr[gender]" type="custom_discrete_probability">
      <probability argument="0" value='0.493' /> <!-- Male probability -->
      <probability argument="1" value='0.507' /> <!-- Female probability -->
    </function>
  </functions>

  <!-- string sets -->
  <string_sets>
    <!-- male first names -->
    <string_set key="male_names">
      <item value="James">
        <probability function="Pr[male_name]" value='0.0372726560947861000' />
      </item>
      <item value="John">
        <probability function="Pr[male_name]" value='0.0367004386998328000' />
      </item>
      <item value="Robert">
        <probability function="Pr[male_name]" value='0.0352642857944282000' />
      </item>
    </string_set>
  </string_sets>

</generator_catalog>